
*** Running vivado
    with args -log FSM_Complete.vdi -applog -m64 -product Vivado -messageDb vivado.pb -mode batch -source FSM_Complete.tcl -notrace



****** Vivado v2025.2 (64-bit)
  **** SW Build 6299465 on Fri Nov 14 19:35:11 GMT 2025
  **** IP Build 6300035 on Fri Nov 14 10:48:45 MST 2025
  **** SharedData Build 6298862 on Thu Nov 13 04:50:51 MST 2025
  **** Start of session at: Fri Feb 13 00:03:54 2026
    ** Copyright 1986-2022 Xilinx, Inc. All Rights Reserved.
    ** Copyright 2022-2025 Advanced Micro Devices, Inc. All Rights Reserved.

source FSM_Complete.tcl -notrace
create_project: Time (s): cpu = 00:00:19 ; elapsed = 00:00:13 . Memory (MB): peak = 556.734 ; gain = 220.445
Command: link_design -top FSM_Complete -part xc7a35tcpg236-1
Design is defaulting to srcset: sources_1
Design is defaulting to constrset: constrs_1
INFO: [Device 21-403] Loading part xc7a35tcpg236-1
Netlist sorting complete. Time (s): cpu = 00:00:00 ; elapsed = 00:00:00 . Memory (MB): peak = 764.926 ; gain = 0.000
INFO: [Netlist 29-17] Analyzing 7 Unisim elements for replacement
INFO: [Netlist 29-28] Unisim Transformation completed in 0 CPU seconds
INFO: [Project 1-479] Netlist was created with Vivado 2025.2
INFO: [Project 1-570] Preparing netlist for logic optimization
Parsing XDC File [C:/Vivado/Basys3_Parciales/Basys3_Parciales.srcs/constrs_1/new/basys3.xdc]
Finished Parsing XDC File [C:/Vivado/Basys3_Parciales/Basys3_Parciales.srcs/constrs_1/new/basys3.xdc]
INFO: [Opt 31-138] Pushed 0 inverter(s) to 0 load pin(s).
Netlist sorting complete. Time (s): cpu = 00:00:00 ; elapsed = 00:00:00 . Memory (MB): peak = 901.180 ; gain = 0.000
INFO: [Project 1-111] Unisim Transformation Summary:
No Unisim elements were transformed.

7 Infos, 0 Warnings, 0 Critical Warnings and 0 Errors encountered.
link_design completed successfully
link_design: Time (s): cpu = 00:00:06 ; elapsed = 00:00:08 . Memory (MB): peak = 905.195 ; gain = 348.461
Command: opt_design
Attempting to get a license for feature 'Implementation' and/or device 'xc7a35t'
INFO: [Common 17-349] Got license for feature 'Implementation' and/or device 'xc7a35t'
Running DRC as a precondition to command opt_design

Starting DRC Task
INFO: [DRC 23-27] Running DRC with 2 threads
INFO: [Project 1-461] DRC finished with 0 Errors
INFO: [Project 1-462] Please refer to the DRC report (report_drc) for more information.

Time (s): cpu = 00:00:03 ; elapsed = 00:00:02 . Memory (MB): peak = 932.676 ; gain = 27.480

Starting Cache Timing Information Task
INFO: [Timing 38-35] Done setting XDC timing constraints.
Ending Cache Timing Information Task | Checksum: 21819e85c

Time (s): cpu = 00:00:11 ; elapsed = 00:00:12 . Memory (MB): peak = 1461.035 ; gain = 528.359

Starting Logic Optimization Task

Phase 1 Initialization

Phase 1.1 Core Generation And Design Setup
Phase 1.1 Core Generation And Design Setup | Checksum: 21819e85c

Time (s): cpu = 00:00:00 ; elapsed = 00:00:00.004 . Memory (MB): peak = 1921.355 ; gain = 0.000

Phase 1.2 Setup Constraints And Sort Netlist
Phase 1.2 Setup Constraints And Sort Netlist | Checksum: 21819e85c

Time (s): cpu = 00:00:00 ; elapsed = 00:00:00.006 . Memory (MB): peak = 1921.355 ; gain = 0.000
Phase 1 Initialization | Checksum: 21819e85c

Time (s): cpu = 00:00:00 ; elapsed = 00:00:00.007 . Memory (MB): peak = 1921.355 ; gain = 0.000

Phase 2 Timer Update And Timing Data Collection

Phase 2.1 Detect if minReqCache needed
Phase 2.1 Detect if minReqCache needed | Checksum: 21819e85c

Time (s): cpu = 00:00:00 ; elapsed = 00:00:00.014 . Memory (MB): peak = 1921.355 ; gain = 0.000

Phase 2.2 Timer Update
Phase 2.2 Timer Update | Checksum: 21819e85c

Time (s): cpu = 00:00:00 ; elapsed = 00:00:00.023 . Memory (MB): peak = 1921.355 ; gain = 0.000

Phase 2.3 Timing Data Collection
Phase 2.3 Timing Data Collection | Checksum: 21819e85c

Time (s): cpu = 00:00:00 ; elapsed = 00:00:00.025 . Memory (MB): peak = 1921.355 ; gain = 0.000
Phase 2 Timer Update And Timing Data Collection | Checksum: 21819e85c

Time (s): cpu = 00:00:00 ; elapsed = 00:00:00.026 . Memory (MB): peak = 1921.355 ; gain = 0.000

Phase 3 Retarget
INFO: [Opt 31-1851] Number of loadless carry chains removed were: 0
INFO: [Opt 31-1834] Total Chains To Be Transformed Were: 0 AND Number of Transformed insts Created are: 0
INFO: [Opt 31-138] Pushed 0 inverter(s) to 0 load pin(s).
INFO: [Opt 31-49] Retargeted 0 cell(s).
Phase 3 Retarget | Checksum: 21819e85c

Time (s): cpu = 00:00:00 ; elapsed = 00:00:00.037 . Memory (MB): peak = 1921.355 ; gain = 0.000
Retarget | Checksum: 21819e85c
INFO: [Opt 31-389] Phase Retarget created 0 cells and removed 0 cells

Phase 4 Constant propagation
INFO: [Opt 31-138] Pushed 0 inverter(s) to 0 load pin(s).
Phase 4 Constant propagation | Checksum: 21819e85c

Time (s): cpu = 00:00:00 ; elapsed = 00:00:00.043 . Memory (MB): peak = 1921.355 ; gain = 0.000
Constant propagation | Checksum: 21819e85c
INFO: [Opt 31-389] Phase Constant propagation created 0 cells and removed 0 cells

Phase 5 Sweep
INFO: [Constraints 18-11670] Building netlist checker database with flags, 0x8
Done building netlist checker database: Time (s): cpu = 00:00:00 ; elapsed = 00:00:00 . Memory (MB): peak = 1921.355 ; gain = 0.000
Phase 5 Sweep | Checksum: 28f72ebdd

Time (s): cpu = 00:00:00 ; elapsed = 00:00:00.050 . Memory (MB): peak = 1921.355 ; gain = 0.000
Sweep | Checksum: 28f72ebdd
INFO: [Opt 31-389] Phase Sweep created 0 cells and removed 0 cells

Phase 6 BUFG optimization
Phase 6 BUFG optimization | Checksum: 28f72ebdd

Time (s): cpu = 00:00:00 ; elapsed = 00:00:00.067 . Memory (MB): peak = 1921.355 ; gain = 0.000
BUFG optimization | Checksum: 28f72ebdd
INFO: [Opt 31-662] Phase BUFG optimization created 0 cells of which 0 are BUFGs and removed 0 cells.

Phase 7 Shift Register Optimization
INFO: [Opt 31-1064] SRL Remap converted 0 SRLs to 0 registers and converted 0 registers of register chains to 0 SRLs
Phase 7 Shift Register Optimization | Checksum: 28f72ebdd

Time (s): cpu = 00:00:00 ; elapsed = 00:00:00.071 . Memory (MB): peak = 1921.355 ; gain = 0.000
Shift Register Optimization | Checksum: 28f72ebdd
INFO: [Opt 31-389] Phase Shift Register Optimization created 0 cells and removed 0 cells

Phase 8 Post Processing Netlist
Phase 8 Post Processing Netlist | Checksum: 28f72ebdd

Time (s): cpu = 00:00:00 ; elapsed = 00:00:00.075 . Memory (MB): peak = 1921.355 ; gain = 0.000
Post Processing Netlist | Checksum: 28f72ebdd
INFO: [Opt 31-389] Phase Post Processing Netlist created 0 cells and removed 0 cells

Phase 9 Finalization

Phase 9.1 Finalizing Design Cores and Updating Shapes
Phase 9.1 Finalizing Design Cores and Updating Shapes | Checksum: 1ab14ca6f

Time (s): cpu = 00:00:00 ; elapsed = 00:00:00.089 . Memory (MB): peak = 1921.355 ; gain = 0.000

Phase 9.2 Verifying Netlist Connectivity

Starting Connectivity Check Task

Time (s): cpu = 00:00:00 ; elapsed = 00:00:00.012 . Memory (MB): peak = 1921.355 ; gain = 0.000
Phase 9.2 Verifying Netlist Connectivity | Checksum: 1ab14ca6f

Time (s): cpu = 00:00:00 ; elapsed = 00:00:00.104 . Memory (MB): peak = 1921.355 ; gain = 0.000
Phase 9 Finalization | Checksum: 1ab14ca6f

Time (s): cpu = 00:00:00 ; elapsed = 00:00:00.105 . Memory (MB): peak = 1921.355 ; gain = 0.000
Opt_design Change Summary
=========================


-------------------------------------------------------------------------------------------------------------------------
|  Phase                        |  #Cells created  |  #Cells Removed  |  #Constrained objects preventing optimizations  |
-------------------------------------------------------------------------------------------------------------------------
|  Retarget                     |               0  |               0  |                                              0  |
|  Constant propagation         |               0  |               0  |                                              0  |
|  Sweep                        |               0  |               0  |                                              0  |
|  BUFG optimization            |               0  |               0  |                                              0  |
|  Shift Register Optimization  |               0  |               0  |                                              0  |
|  Post Processing Netlist      |               0  |               0  |                                              0  |
-------------------------------------------------------------------------------------------------------------------------


Ending Logic Optimization Task | Checksum: 1ab14ca6f

Time (s): cpu = 00:00:00 ; elapsed = 00:00:00.110 . Memory (MB): peak = 1921.355 ; gain = 0.000

Starting Power Optimization Task
INFO: [Pwropt 34-132] Skipping clock gating for clocks with a period < 2.00 ns.
Ending Power Optimization Task | Checksum: 1ab14ca6f

Time (s): cpu = 00:00:00 ; elapsed = 00:00:00.015 . Memory (MB): peak = 1921.355 ; gain = 0.000

Starting Final Cleanup Task
Ending Final Cleanup Task | Checksum: 1ab14ca6f

Time (s): cpu = 00:00:00 ; elapsed = 00:00:00.001 . Memory (MB): peak = 1921.355 ; gain = 0.000
Netlist sorting complete. Time (s): cpu = 00:00:00 ; elapsed = 00:00:00 . Memory (MB): peak = 1921.355 ; gain = 0.000
INFO: [Common 17-83] Releasing license: Implementation
27 Infos, 0 Warnings, 0 Critical Warnings and 0 Errors encountered.
opt_design completed successfully
opt_design: Time (s): cpu = 00:00:21 ; elapsed = 00:00:21 . Memory (MB): peak = 1921.355 ; gain = 1016.160
INFO: [Vivado 12-24828] Executing command : report_drc -file FSM_Complete_drc_opted.rpt -pb FSM_Complete_drc_opted.pb -rpx FSM_Complete_drc_opted.rpx
Command: report_drc -file FSM_Complete_drc_opted.rpt -pb FSM_Complete_drc_opted.pb -rpx FSM_Complete_drc_opted.rpx
INFO: [IP_Flow 19-234] Refreshing IP repositories
INFO: [IP_Flow 19-1704] No user IP repositories specified
INFO: [IP_Flow 19-2313] Loaded Vivado IP repository 'C:/AMDDesignTools/2025.2/Vivado/data/ip'.
INFO: [DRC 23-27] Running DRC with 2 threads
INFO: [Vivado_Tcl 2-168] The results of DRC are in file C:/Vivado/Basys3_Parciales/Basys3_Parciales.runs/impl_1/FSM_Complete_drc_opted.rpt.
report_drc completed successfully
report_drc: Time (s): cpu = 00:00:06 ; elapsed = 00:00:06 . Memory (MB): peak = 1921.355 ; gain = 0.000
generate_parallel_reports: Time (s): cpu = 00:00:06 ; elapsed = 00:00:06 . Memory (MB): peak = 1921.355 ; gain = 0.000
INFO: [Timing 38-480] Writing timing data to binary archive.
Write ShapeDB Complete: Time (s): cpu = 00:00:00 ; elapsed = 00:00:00.002 . Memory (MB): peak = 1921.355 ; gain = 0.000
Wrote PlaceDB: Time (s): cpu = 00:00:00 ; elapsed = 00:00:00 . Memory (MB): peak = 1921.355 ; gain = 0.000
Wrote PulsedLatchDB: Time (s): cpu = 00:00:00 ; elapsed = 00:00:00.001 . Memory (MB): peak = 1921.355 ; gain = 0.000
Writing XDEF routing.
Writing XDEF routing logical nets.
Writing XDEF routing special nets.
Wrote RouteStorage: Time (s): cpu = 00:00:00 ; elapsed = 00:00:00.043 . Memory (MB): peak = 1921.355 ; gain = 0.000
Wrote PlaceStorage: Time (s): cpu = 00:00:00 ; elapsed = 00:00:00.002 . Memory (MB): peak = 1921.355 ; gain = 0.000
Wrote Netlist Cache: Time (s): cpu = 00:00:00 ; elapsed = 00:00:00.001 . Memory (MB): peak = 1921.355 ; gain = 0.000
Wrote Device Cache: Time (s): cpu = 00:00:00 ; elapsed = 00:00:00.018 . Memory (MB): peak = 1921.355 ; gain = 0.000
Write Physdb Complete: Time (s): cpu = 00:00:00 ; elapsed = 00:00:00.082 . Memory (MB): peak = 1921.355 ; gain = 0.000
INFO: [Common 17-1381] The checkpoint 'C:/Vivado/Basys3_Parciales/Basys3_Parciales.runs/impl_1/FSM_Complete_opt.dcp' has been generated.
Command: place_design
Attempting to get a license for feature 'Implementation' and/or device 'xc7a35t'
INFO: [Common 17-349] Got license for feature 'Implementation' and/or device 'xc7a35t'
INFO: [Common 17-83] Releasing license: Implementation
INFO: [DRC 23-27] Running DRC with 2 threads
INFO: [Vivado_Tcl 4-198] DRC finished with 0 Errors
INFO: [Vivado_Tcl 4-199] Please refer to the DRC report (report_drc) for more information.
INFO: [Timing 38-35] Done setting XDC timing constraints.
Running DRC as a precondition to command place_design
INFO: [DRC 23-27] Running DRC with 2 threads
INFO: [Vivado_Tcl 4-198] DRC finished with 0 Errors
INFO: [Vivado_Tcl 4-199] Please refer to the DRC report (report_drc) for more information.
INFO: [Place 30-611] Multithreading enabled for place_design using a maximum of 2 CPUs

Starting Placer Task

Phase 1 Placer Initialization

Phase 1.1 Placer Initialization Netlist Sorting
Netlist sorting complete. Time (s): cpu = 00:00:00 ; elapsed = 00:00:00 . Memory (MB): peak = 1921.355 ; gain = 0.000
Phase 1.1 Placer Initialization Netlist Sorting | Checksum: 195186e06

Time (s): cpu = 00:00:00 ; elapsed = 00:00:00.004 . Memory (MB): peak = 1921.355 ; gain = 0.000
Netlist sorting complete. Time (s): cpu = 00:00:00 ; elapsed = 00:00:00 . Memory (MB): peak = 1921.355 ; gain = 0.000

Phase 1.2 IO Placement/ Clock Placement/ Build Placer Device
Phase 1.2 IO Placement/ Clock Placement/ Build Placer Device | Checksum: 2303f84a6

Time (s): cpu = 00:00:01 ; elapsed = 00:00:00.418 . Memory (MB): peak = 1921.355 ; gain = 0.000

Phase 1.3 Build Placer Netlist Model
WARNING: [Place 30-2953] Timing driven mode will be turned off because no critical terminals were found.
Phase 1.3 Build Placer Netlist Model | Checksum: 2e1b9129a

Time (s): cpu = 00:00:01 ; elapsed = 00:00:00.537 . Memory (MB): peak = 1921.355 ; gain = 0.000

Phase 1.4 Constrain Clocks/Macros
Phase 1.4 Constrain Clocks/Macros | Checksum: 2e1b9129a

Time (s): cpu = 00:00:01 ; elapsed = 00:00:00.543 . Memory (MB): peak = 1921.355 ; gain = 0.000
Phase 1 Placer Initialization | Checksum: 2e1b9129a

Time (s): cpu = 00:00:01 ; elapsed = 00:00:00.552 . Memory (MB): peak = 1921.355 ; gain = 0.000

Phase 2 Global Placement

Phase 2.1 Floorplanning
Phase 2.1 Floorplanning | Checksum: 2e1b9129a

Time (s): cpu = 00:00:01 ; elapsed = 00:00:00.557 . Memory (MB): peak = 1921.355 ; gain = 0.000

Phase 2.2 Update Timing before SLR Path Opt
Phase 2.2 Update Timing before SLR Path Opt | Checksum: 2e1b9129a

Time (s): cpu = 00:00:01 ; elapsed = 00:00:00.560 . Memory (MB): peak = 1921.355 ; gain = 0.000

Phase 2.3 Post-Processing in Floorplanning
Phase 2.3 Post-Processing in Floorplanning | Checksum: 2e1b9129a

Time (s): cpu = 00:00:01 ; elapsed = 00:00:00.562 . Memory (MB): peak = 1921.355 ; gain = 0.000

Phase 2.4 Global Place Phase1
Phase 2.4 Global Place Phase1 | Checksum: 2be4c08ee

Time (s): cpu = 00:00:02 ; elapsed = 00:00:00.872 . Memory (MB): peak = 1921.355 ; gain = 0.000

Phase 2.5 Global Place Phase2
WARNING: [Place 46-29] Timing had been disabled during Placer and, therefore, physical synthesis in Placer will be skipped.
Phase 2.5 Global Place Phase2 | Checksum: 2a422f388

Time (s): cpu = 00:00:02 ; elapsed = 00:00:00.938 . Memory (MB): peak = 1921.355 ; gain = 0.000
Phase 2 Global Placement | Checksum: 2a422f388

Time (s): cpu = 00:00:02 ; elapsed = 00:00:00.942 . Memory (MB): peak = 1921.355 ; gain = 0.000

Phase 3 Detail Placement

Phase 3.1 Commit Multi Column Macros
Phase 3.1 Commit Multi Column Macros | Checksum: 2a422f388

Time (s): cpu = 00:00:02 ; elapsed = 00:00:00.950 . Memory (MB): peak = 1921.355 ; gain = 0.000

Phase 3.2 Commit Most Macros & LUTRAMs
Phase 3.2 Commit Most Macros & LUTRAMs | Checksum: 28092bf4d

Time (s): cpu = 00:00:02 ; elapsed = 00:00:00.968 . Memory (MB): peak = 1921.355 ; gain = 0.000

Phase 3.3 Area Swap Optimization
Phase 3.3 Area Swap Optimization | Checksum: 2859a8ad5

Time (s): cpu = 00:00:02 ; elapsed = 00:00:00.977 . Memory (MB): peak = 1921.355 ; gain = 0.000

Phase 3.4 Pipeline Register Optimization
Phase 3.4 Pipeline Register Optimization | Checksum: 2859a8ad5

Time (s): cpu = 00:00:02 ; elapsed = 00:00:00.982 . Memory (MB): peak = 1921.355 ; gain = 0.000

Phase 3.5 Small Shape Detail Placement
Phase 3.5 Small Shape Detail Placement | Checksum: 2f9522d06

Time (s): cpu = 00:00:02 ; elapsed = 00:00:01 . Memory (MB): peak = 1921.355 ; gain = 0.000

Phase 3.6 Re-assign LUT pins
Phase 3.6 Re-assign LUT pins | Checksum: 25df81ef1

Time (s): cpu = 00:00:02 ; elapsed = 00:00:01 . Memory (MB): peak = 1921.355 ; gain = 0.000

Phase 3.7 Pipeline Register Optimization
Phase 3.7 Pipeline Register Optimization | Checksum: 25df81ef1

Time (s): cpu = 00:00:02 ; elapsed = 00:00:01 . Memory (MB): peak = 1921.355 ; gain = 0.000
Phase 3 Detail Placement | Checksum: 25df81ef1

Time (s): cpu = 00:00:02 ; elapsed = 00:00:01 . Memory (MB): peak = 1921.355 ; gain = 0.000

Phase 4 Post Placement Optimization and Clean-Up

Phase 4.1 Post Commit Optimization
Phase 4.1 Post Commit Optimization | Checksum: 25df81ef1

Time (s): cpu = 00:00:02 ; elapsed = 00:00:01 . Memory (MB): peak = 1921.355 ; gain = 0.000

Phase 4.2 Post Placement Cleanup
Phase 4.2 Post Placement Cleanup | Checksum: 25df81ef1

Time (s): cpu = 00:00:02 ; elapsed = 00:00:01 . Memory (MB): peak = 1921.355 ; gain = 0.000

Phase 4.3 Placer Reporting

Phase 4.3.1 Print Estimated Congestion
INFO: [Place 30-612] Post-Placement Estimated Congestion 
 ____________________________________________________
|           | Global Congestion | Short Congestion  |
| Direction | Region Size       | Region Size       |
|___________|___________________|___________________|
|      North|                1x1|                1x1|
|___________|___________________|___________________|
|      South|                1x1|                1x1|
|___________|___________________|___________________|
|       East|                1x1|                1x1|
|___________|___________________|___________________|
|       West|                1x1|                1x1|
|___________|___________________|___________________|

Phase 4.3.1 Print Estimated Congestion | Checksum: 25df81ef1

Time (s): cpu = 00:00:02 ; elapsed = 00:00:01 . Memory (MB): peak = 1921.355 ; gain = 0.000
Phase 4.3 Placer Reporting | Checksum: 25df81ef1

Time (s): cpu = 00:00:02 ; elapsed = 00:00:01 . Memory (MB): peak = 1921.355 ; gain = 0.000

Phase 4.4 Final Placement Cleanup
Netlist sorting complete. Time (s): cpu = 00:00:00 ; elapsed = 00:00:00 . Memory (MB): peak = 1921.355 ; gain = 0.000

Time (s): cpu = 00:00:02 ; elapsed = 00:00:01 . Memory (MB): peak = 1921.355 ; gain = 0.000
Phase 4 Post Placement Optimization and Clean-Up | Checksum: 1d9daea43

Time (s): cpu = 00:00:02 ; elapsed = 00:00:01 . Memory (MB): peak = 1921.355 ; gain = 0.000
Ending Placer Task | Checksum: 14fc24473

Time (s): cpu = 00:00:02 ; elapsed = 00:00:01 . Memory (MB): peak = 1921.355 ; gain = 0.000
46 Infos, 2 Warnings, 0 Critical Warnings and 0 Errors encountered.
place_design completed successfully
INFO: [Vivado 12-24838] Running report commands "report_control_sets, report_io, report_utilization" in parallel.
Running report generation with 2 threads.
INFO: [Vivado 12-24828] Executing command : report_utilization -file FSM_Complete_utilization_placed.rpt -pb FSM_Complete_utilization_placed.pb
INFO: [Vivado 12-24828] Executing command : report_control_sets -verbose -file FSM_Complete_control_sets_placed.rpt
report_control_sets: Time (s): cpu = 00:00:00 ; elapsed = 00:00:00.006 . Memory (MB): peak = 1921.355 ; gain = 0.000
INFO: [Vivado 12-24828] Executing command : report_io -file FSM_Complete_io_placed.rpt
report_io: Time (s): cpu = 00:00:01 ; elapsed = 00:00:00.184 . Memory (MB): peak = 1921.355 ; gain = 0.000
Write ShapeDB Complete: Time (s): cpu = 00:00:00 ; elapsed = 00:00:00.002 . Memory (MB): peak = 1921.355 ; gain = 0.000
INFO: [Timing 38-480] Writing timing data to binary archive.
Wrote PlaceDB: Time (s): cpu = 00:00:00 ; elapsed = 00:00:00 . Memory (MB): peak = 1921.355 ; gain = 0.000
Wrote PulsedLatchDB: Time (s): cpu = 00:00:00 ; elapsed = 00:00:00 . Memory (MB): peak = 1921.355 ; gain = 0.000
Writing XDEF routing.
Writing XDEF routing logical nets.
Writing XDEF routing special nets.
Wrote RouteStorage: Time (s): cpu = 00:00:00 ; elapsed = 00:00:00.044 . Memory (MB): peak = 1921.355 ; gain = 0.000
Wrote PlaceStorage: Time (s): cpu = 00:00:00 ; elapsed = 00:00:00.012 . Memory (MB): peak = 1921.355 ; gain = 0.000
Wrote Netlist Cache: Time (s): cpu = 00:00:00 ; elapsed = 00:00:00 . Memory (MB): peak = 1921.355 ; gain = 0.000
Wrote Device Cache: Time (s): cpu = 00:00:00 ; elapsed = 00:00:00.019 . Memory (MB): peak = 1921.355 ; gain = 0.000
Write Physdb Complete: Time (s): cpu = 00:00:00 ; elapsed = 00:00:00.092 . Memory (MB): peak = 1921.355 ; gain = 0.000
INFO: [Common 17-1381] The checkpoint 'C:/Vivado/Basys3_Parciales/Basys3_Parciales.runs/impl_1/FSM_Complete_placed.dcp' has been generated.
Command: phys_opt_design
Attempting to get a license for feature 'Implementation' and/or device 'xc7a35t'
INFO: [Common 17-349] Got license for feature 'Implementation' and/or device 'xc7a35t'

Starting Initial Update Timing Task
INFO: [Timing 38-35] Done setting XDC timing constraints.

Time (s): cpu = 00:00:00 ; elapsed = 00:00:00.072 . Memory (MB): peak = 1921.355 ; gain = 0.000
INFO: [Vivado_Tcl 4-2279] Estimated Timing Summary | WNS= 7.488 | TNS= 0.000 | 
INFO: [Vivado_Tcl 4-383] Design worst setup slack (WNS) is greater than or equal to 0.000 ns. All physical synthesis setup optimizations will be skipped.
INFO: [Vivado_Tcl 4-232] No setup violation found. The netlist was not modified.
INFO: [Common 17-83] Releasing license: Implementation
58 Infos, 2 Warnings, 0 Critical Warnings and 0 Errors encountered.
phys_opt_design completed successfully
Write ShapeDB Complete: Time (s): cpu = 00:00:00 ; elapsed = 00:00:00.002 . Memory (MB): peak = 1921.355 ; gain = 0.000
Wrote PlaceDB: Time (s): cpu = 00:00:00 ; elapsed = 00:00:00 . Memory (MB): peak = 1921.355 ; gain = 0.000
INFO: [Timing 38-480] Writing timing data to binary archive.
Wrote PulsedLatchDB: Time (s): cpu = 00:00:00 ; elapsed = 00:00:00 . Memory (MB): peak = 1921.355 ; gain = 0.000
Writing XDEF routing.
Writing XDEF routing logical nets.
Writing XDEF routing special nets.
Wrote RouteStorage: Time (s): cpu = 00:00:00 ; elapsed = 00:00:00.037 . Memory (MB): peak = 1921.355 ; gain = 0.000
Wrote PlaceStorage: Time (s): cpu = 00:00:00 ; elapsed = 00:00:00.012 . Memory (MB): peak = 1921.355 ; gain = 0.000
Wrote Netlist Cache: Time (s): cpu = 00:00:00 ; elapsed = 00:00:00.001 . Memory (MB): peak = 1921.355 ; gain = 0.000
Wrote Device Cache: Time (s): cpu = 00:00:00 ; elapsed = 00:00:00.016 . Memory (MB): peak = 1921.355 ; gain = 0.000
Write Physdb Complete: Time (s): cpu = 00:00:00 ; elapsed = 00:00:00.086 . Memory (MB): peak = 1921.355 ; gain = 0.000
INFO: [Common 17-1381] The checkpoint 'C:/Vivado/Basys3_Parciales/Basys3_Parciales.runs/impl_1/FSM_Complete_physopt.dcp' has been generated.
Command: route_design
Attempting to get a license for feature 'Implementation' and/or device 'xc7a35t'
INFO: [Common 17-349] Got license for feature 'Implementation' and/or device 'xc7a35t'


Starting Routing Task
INFO: [Route 35-254] Multithreading enabled for route_design using a maximum of 2 CPUs

Phase 1 Build RT Design
Checksum: PlaceDB: 43b6f903 ConstDB: 0 ShapeSum: 6b89ef19 RouteDB: a0815c57
Post Restoration Checksum: NetGraph: a239654c | NumContArr: c45db212 | Constraints: c2a8fa9d | Timing: c2a8fa9d
Phase 1 Build RT Design | Checksum: 2ebe90c98

Time (s): cpu = 00:00:40 ; elapsed = 00:00:38 . Memory (MB): peak = 1921.355 ; gain = 0.000

Phase 2 Router Initialization

Phase 2.1 Fix Topology Constraints
Phase 2.1 Fix Topology Constraints | Checksum: 2ebe90c98

Time (s): cpu = 00:00:40 ; elapsed = 00:00:38 . Memory (MB): peak = 1921.355 ; gain = 0.000

Phase 2.2 Pre Route Cleanup
Phase 2.2 Pre Route Cleanup | Checksum: 2ebe90c98

Time (s): cpu = 00:00:40 ; elapsed = 00:00:38 . Memory (MB): peak = 1921.355 ; gain = 0.000
 Number of Nodes with overlaps = 0

Phase 2.3 Update Timing
Phase 2.3 Update Timing | Checksum: 1cbf350ef

Time (s): cpu = 00:00:40 ; elapsed = 00:00:38 . Memory (MB): peak = 1921.355 ; gain = 0.000
INFO: [Route 35-416] Intermediate Timing Summary | WNS=7.394  | TNS=0.000  | WHS=0.004  | THS=0.000  |


Phase 2.4 Soft Constraint Pins - Fast Budgeting
Phase 2.4 Soft Constraint Pins - Fast Budgeting | Checksum: 27c115c0f

Time (s): cpu = 00:00:40 ; elapsed = 00:00:38 . Memory (MB): peak = 1921.355 ; gain = 0.000

Router Utilization Summary
  Global Vertical Routing Utilization    = 0.000398629 %
  Global Horizontal Routing Utilization  = 0 %
  Routable Net Status*
  *Does not include unroutable nets such as driverless and loadless.
  Run report_route_status for detailed report.
  Number of Failed Nets               = 62
    (Failed Nets is the sum of unrouted and partially routed nets)
  Number of Unrouted Nets             = 61
  Number of Partially Routed Nets     = 1
  Number of Node Overlaps             = 0

Phase 2 Router Initialization | Checksum: 1c09ad094

Time (s): cpu = 00:00:41 ; elapsed = 00:00:38 . Memory (MB): peak = 1921.355 ; gain = 0.000

Phase 3 Global Routing
Phase 3 Global Routing | Checksum: 1c09ad094

Time (s): cpu = 00:00:41 ; elapsed = 00:00:38 . Memory (MB): peak = 1921.355 ; gain = 0.000

Phase 4 Initial Routing

Phase 4.1 Initial Net Routing Pass
Phase 4.1 Initial Net Routing Pass | Checksum: 2a665b8da

Time (s): cpu = 00:00:41 ; elapsed = 00:00:38 . Memory (MB): peak = 1921.355 ; gain = 0.000
Phase 4 Initial Routing | Checksum: 2a665b8da

Time (s): cpu = 00:00:41 ; elapsed = 00:00:38 . Memory (MB): peak = 1921.355 ; gain = 0.000

Phase 5 Rip-up And Reroute

Phase 5.1 Global Iteration 0
 Number of Nodes with overlaps = 2
 Number of Nodes with overlaps = 0
INFO: [Route 35-416] Intermediate Timing Summary | WNS=7.110  | TNS=0.000  | WHS=N/A    | THS=N/A    |

Phase 5.1 Global Iteration 0 | Checksum: 27ed84301

Time (s): cpu = 00:00:41 ; elapsed = 00:00:38 . Memory (MB): peak = 1921.355 ; gain = 0.000
Phase 5 Rip-up And Reroute | Checksum: 27ed84301

Time (s): cpu = 00:00:41 ; elapsed = 00:00:38 . Memory (MB): peak = 1921.355 ; gain = 0.000

Phase 6 Delay and Skew Optimization

Phase 6.1 Delay CleanUp
Phase 6.1 Delay CleanUp | Checksum: 27ed84301

Time (s): cpu = 00:00:41 ; elapsed = 00:00:38 . Memory (MB): peak = 1921.355 ; gain = 0.000

Phase 6.2 Clock Skew Optimization
Phase 6.2 Clock Skew Optimization | Checksum: 27ed84301

Time (s): cpu = 00:00:41 ; elapsed = 00:00:38 . Memory (MB): peak = 1921.355 ; gain = 0.000
Phase 6 Delay and Skew Optimization | Checksum: 27ed84301

Time (s): cpu = 00:00:41 ; elapsed = 00:00:38 . Memory (MB): peak = 1921.355 ; gain = 0.000

Phase 7 Post Hold Fix

Phase 7.1 Hold Fix Iter
INFO: [Route 35-416] Intermediate Timing Summary | WNS=7.203  | TNS=0.000  | WHS=0.307  | THS=0.000  |

Phase 7.1 Hold Fix Iter | Checksum: 293fe9637

Time (s): cpu = 00:00:41 ; elapsed = 00:00:39 . Memory (MB): peak = 1921.355 ; gain = 0.000
Phase 7 Post Hold Fix | Checksum: 293fe9637

Time (s): cpu = 00:00:41 ; elapsed = 00:00:39 . Memory (MB): peak = 1921.355 ; gain = 0.000

Phase 8 Route finalize

Router Utilization Summary
  Global Vertical Routing Utilization    = 0.0111616 %
  Global Horizontal Routing Utilization  = 0.0203019 %
  Routable Net Status*
  *Does not include unroutable nets such as driverless and loadless.
  Run report_route_status for detailed report.
  Number of Failed Nets               = 0
    (Failed Nets is the sum of unrouted and partially routed nets)
  Number of Unrouted Nets             = 0
  Number of Partially Routed Nets     = 0
  Number of Node Overlaps             = 0

Phase 8 Route finalize | Checksum: 293fe9637

Time (s): cpu = 00:00:41 ; elapsed = 00:00:39 . Memory (MB): peak = 1921.355 ; gain = 0.000

Phase 9 Verifying routed nets

 Verification completed successfully
Phase 9 Verifying routed nets | Checksum: 293fe9637

Time (s): cpu = 00:00:41 ; elapsed = 00:00:39 . Memory (MB): peak = 1921.355 ; gain = 0.000

Phase 10 Depositing Routes
Phase 10 Depositing Routes | Checksum: 24ff3bdb0

Time (s): cpu = 00:00:41 ; elapsed = 00:00:39 . Memory (MB): peak = 1921.355 ; gain = 0.000

Phase 11 Post Process Routing
Phase 11 Post Process Routing | Checksum: 24ff3bdb0

Time (s): cpu = 00:00:41 ; elapsed = 00:00:39 . Memory (MB): peak = 1921.355 ; gain = 0.000

Phase 12 Post Router Timing
INFO: [Route 35-57] Estimated Timing Summary | WNS=7.203  | TNS=0.000  | WHS=0.307  | THS=0.000  |

INFO: [Route 35-327] The final timing numbers are based on the router estimated timing analysis. For a complete and accurate timing signoff, please run report_timing_summary.
Phase 12 Post Router Timing | Checksum: 24ff3bdb0

Time (s): cpu = 00:00:41 ; elapsed = 00:00:39 . Memory (MB): peak = 1921.355 ; gain = 0.000
Total Elapsed time in route_design: 38.588 secs

Phase 13 Post-Route Event Processing
Phase 13 Post-Route Event Processing | Checksum: 1377fb3f9

Time (s): cpu = 00:00:41 ; elapsed = 00:00:39 . Memory (MB): peak = 1921.355 ; gain = 0.000
INFO: [Route 35-16] Router Completed Successfully
Ending Routing Task | Checksum: 1377fb3f9

Time (s): cpu = 00:00:41 ; elapsed = 00:00:39 . Memory (MB): peak = 1921.355 ; gain = 0.000

Routing Is Done.
INFO: [Common 17-83] Releasing license: Implementation
69 Infos, 2 Warnings, 0 Critical Warnings and 0 Errors encountered.
route_design completed successfully
route_design: Time (s): cpu = 00:00:41 ; elapsed = 00:00:39 . Memory (MB): peak = 1921.355 ; gain = 0.000
INFO: [Vivado 12-24828] Executing command : report_drc -file FSM_Complete_drc_routed.rpt -pb FSM_Complete_drc_routed.pb -rpx FSM_Complete_drc_routed.rpx
Command: report_drc -file FSM_Complete_drc_routed.rpt -pb FSM_Complete_drc_routed.pb -rpx FSM_Complete_drc_routed.rpx
INFO: [IP_Flow 19-1839] IP Catalog is up to date.
INFO: [DRC 23-27] Running DRC with 2 threads
INFO: [Vivado_Tcl 2-168] The results of DRC are in file C:/Vivado/Basys3_Parciales/Basys3_Parciales.runs/impl_1/FSM_Complete_drc_routed.rpt.
report_drc completed successfully
report_drc: Time (s): cpu = 00:00:06 ; elapsed = 00:00:05 . Memory (MB): peak = 1921.355 ; gain = 0.000
INFO: [Vivado 12-24828] Executing command : report_methodology -file FSM_Complete_methodology_drc_routed.rpt -pb FSM_Complete_methodology_drc_routed.pb -rpx FSM_Complete_methodology_drc_routed.rpx
Command: report_methodology -file FSM_Complete_methodology_drc_routed.rpt -pb FSM_Complete_methodology_drc_routed.pb -rpx FSM_Complete_methodology_drc_routed.rpx
INFO: [Timing 38-35] Done setting XDC timing constraints.
INFO: [DRC 23-133] Running Methodology with 2 threads
INFO: [Vivado_Tcl 2-1520] The results of Report Methodology are in file C:/Vivado/Basys3_Parciales/Basys3_Parciales.runs/impl_1/FSM_Complete_methodology_drc_routed.rpt.
report_methodology completed successfully
INFO: [Vivado 12-24828] Executing command : report_timing_summary -max_paths 10 -routable_nets -report_unconstrained -file FSM_Complete_timing_summary_routed.rpt -pb FSM_Complete_timing_summary_routed.pb -rpx FSM_Complete_timing_summary_routed.rpx -warn_on_violation 
INFO: [Timing 38-35] Done setting XDC timing constraints.
INFO: [Timing 38-91] UpdateTimingParams: Speed grade: -1, Delay Type: min_max.
INFO: [Timing 38-191] Multithreading enabled for timing update using a maximum of 2 CPUs
INFO: [Vivado 12-24838] Running report commands "report_incremental_reuse, report_route_status" in parallel.
Running report generation with 2 threads.
INFO: [Vivado 12-24828] Executing command : report_incremental_reuse -file FSM_Complete_incremental_reuse_routed.rpt
INFO: [Vivado_Tcl 4-1062] Incremental flow is disabled. No incremental reuse Info to report.
INFO: [Vivado 12-24828] Executing command : report_route_status -file FSM_Complete_route_status.rpt -pb FSM_Complete_route_status.pb
INFO: [Vivado 12-24828] Executing command : report_power -file FSM_Complete_power_routed.rpt -pb FSM_Complete_power_summary_routed.pb -rpx FSM_Complete_power_routed.rpx
Command: report_power -file FSM_Complete_power_routed.rpt -pb FSM_Complete_power_summary_routed.pb -rpx FSM_Complete_power_routed.rpx
Running Vector-less Activity Propagation...

Finished Running Vector-less Activity Propagation
86 Infos, 2 Warnings, 0 Critical Warnings and 0 Errors encountered.
report_power completed successfully
INFO: [Vivado 12-24828] Executing command : report_clock_utilization -file FSM_Complete_clock_utilization_routed.rpt
INFO: [Vivado 12-24828] Executing command : report_bus_skew -warn_on_violation -file FSM_Complete_bus_skew_routed.rpt -pb FSM_Complete_bus_skew_routed.pb -rpx FSM_Complete_bus_skew_routed.rpx
INFO: [Timing 38-91] UpdateTimingParams: Speed grade: -1, Delay Type: min_max.
INFO: [Timing 38-191] Multithreading enabled for timing update using a maximum of 2 CPUs
generate_parallel_reports: Time (s): cpu = 00:00:10 ; elapsed = 00:00:09 . Memory (MB): peak = 1921.355 ; gain = 0.000
INFO: [Timing 38-480] Writing timing data to binary archive.
Write ShapeDB Complete: Time (s): cpu = 00:00:00 ; elapsed = 00:00:00.003 . Memory (MB): peak = 1921.355 ; gain = 0.000
Wrote PlaceDB: Time (s): cpu = 00:00:00 ; elapsed = 00:00:00 . Memory (MB): peak = 1921.355 ; gain = 0.000
Wrote PulsedLatchDB: Time (s): cpu = 00:00:00 ; elapsed = 00:00:00 . Memory (MB): peak = 1921.355 ; gain = 0.000
Writing XDEF routing.
Writing XDEF routing logical nets.
Writing XDEF routing special nets.
Wrote RouteStorage: Time (s): cpu = 00:00:00 ; elapsed = 00:00:00.039 . Memory (MB): peak = 1921.355 ; gain = 0.000
Wrote PlaceStorage: Time (s): cpu = 00:00:00 ; elapsed = 00:00:00.010 . Memory (MB): peak = 1921.355 ; gain = 0.000
Wrote Netlist Cache: Time (s): cpu = 00:00:00 ; elapsed = 00:00:00.001 . Memory (MB): peak = 1921.355 ; gain = 0.000
Wrote Device Cache: Time (s): cpu = 00:00:00 ; elapsed = 00:00:00.015 . Memory (MB): peak = 1921.355 ; gain = 0.000
Write Physdb Complete: Time (s): cpu = 00:00:00 ; elapsed = 00:00:00.084 . Memory (MB): peak = 1921.355 ; gain = 0.000
INFO: [Common 17-1381] The checkpoint 'C:/Vivado/Basys3_Parciales/Basys3_Parciales.runs/impl_1/FSM_Complete_routed.dcp' has been generated.
Command: write_bitstream -force FSM_Complete.bit
Attempting to get a license for feature 'Implementation' and/or device 'xc7a35t'
INFO: [Common 17-349] Got license for feature 'Implementation' and/or device 'xc7a35t'
Running DRC as a precondition to command write_bitstream
INFO: [IP_Flow 19-1839] IP Catalog is up to date.
INFO: [DRC 23-27] Running DRC with 2 threads
INFO: [Vivado 12-3199] DRC finished with 0 Errors
INFO: [Vivado 12-3200] Please refer to the DRC report (report_drc) for more information.
Integrating Hard IP ELF/MEM with the PDI.
INFO: [Designutils 20-2272] Running write_bitstream with 2 threads.
Loading data files...
Loading site data...
Loading route data...
Processing options...
Creating bitmap...
Creating bitstream...
Writing bitstream ./FSM_Complete.bit...
INFO: [Vivado 12-1842] Bitgen Completed Successfully.
INFO: [Common 17-83] Releasing license: Implementation
100 Infos, 2 Warnings, 0 Critical Warnings and 0 Errors encountered.
write_bitstream completed successfully
write_bitstream: Time (s): cpu = 00:00:18 ; elapsed = 00:00:18 . Memory (MB): peak = 2107.820 ; gain = 186.465
INFO: [Common 17-206] Exiting Vivado at Fri Feb 13 00:06:02 2026...

*** Running vivado
    with args -log FSM_Complete.vdi -applog -m64 -product Vivado -messageDb vivado.pb -mode batch -source FSM_Complete.tcl -notrace



****** Vivado v2025.2 (64-bit)
  **** SW Build 6299465 on Fri Nov 14 19:35:11 GMT 2025
  **** IP Build 6300035 on Fri Nov 14 10:48:45 MST 2025
  **** SharedData Build 6298862 on Thu Nov 13 04:50:51 MST 2025
  **** Start of session at: Mon Feb 16 13:37:42 2026
    ** Copyright 1986-2022 Xilinx, Inc. All Rights Reserved.
    ** Copyright 2022-2025 Advanced Micro Devices, Inc. All Rights Reserved.

source FSM_Complete.tcl -notrace
Command: open_checkpoint FSM_Complete_routed.dcp
INFO: [Device 21-403] Loading part xc7a35tcpg236-1
Netlist sorting complete. Time (s): cpu = 00:00:00 ; elapsed = 00:00:00.002 . Memory (MB): peak = 762.727 ; gain = 0.000
INFO: [Netlist 29-17] Analyzing 7 Unisim elements for replacement
INFO: [Netlist 29-28] Unisim Transformation completed in 0 CPU seconds
INFO: [Project 1-479] Netlist was created with Vivado 2025.2
INFO: [Project 1-570] Preparing netlist for logic optimization
Read ShapeDB Complete: Time (s): cpu = 00:00:00 ; elapsed = 00:00:00.005 . Memory (MB): peak = 854.574 ; gain = 0.066
INFO: [Timing 38-478] Restoring timing data from binary archive.
INFO: [Timing 38-479] Binary timing data restore complete.
INFO: [Project 1-856] Restoring constraints from binary archive.
INFO: [Project 1-853] Binary constraint restore complete.
INFO: [Designutils 20-5722] Start Reading Physical Databases.
Reading placement.
Read Netlist Cache: Time (s): cpu = 00:00:00 ; elapsed = 00:00:00 . Memory (MB): peak = 1446.715 ; gain = 0.000
Reading placer database...
Read Device Cache: Time (s): cpu = 00:00:00 ; elapsed = 00:00:00.015 . Memory (MB): peak = 1446.715 ; gain = 0.000
Read PlaceDB: Time (s): cpu = 00:00:00 ; elapsed = 00:00:00 . Memory (MB): peak = 1446.715 ; gain = 0.000
Read placeStorage: Time (s): cpu = 00:00:00 ; elapsed = 00:00:00.006 . Memory (MB): peak = 1446.715 ; gain = 0.000
Read PulsedLatchDB: Time (s): cpu = 00:00:00 ; elapsed = 00:00:00 . Memory (MB): peak = 1446.715 ; gain = 0.000
Reading routing.
Read RouteStorage: Time (s): cpu = 00:00:00 ; elapsed = 00:00:00.017 . Memory (MB): peak = 1446.715 ; gain = 0.000
Read Physdb Files: Time (s): cpu = 00:00:00 ; elapsed = 00:00:00.072 . Memory (MB): peak = 1446.715 ; gain = 0.000
Restored from archive | CPU: 0.000000 secs | Memory: 0.000000 MB |
Finished XDEF File Restore: Time (s): cpu = 00:00:00 ; elapsed = 00:00:00.196 . Memory (MB): peak = 1446.715 ; gain = 8.066
Netlist sorting complete. Time (s): cpu = 00:00:00 ; elapsed = 00:00:00.001 . Memory (MB): peak = 1446.715 ; gain = 0.000
INFO: [Project 1-111] Unisim Transformation Summary:
No Unisim elements were transformed.

INFO: [Project 1-604] Checkpoint was created with Vivado v2025.2 (64-bit) build 6299465
WARNING: [Vivado 12-23575] Critical violations of the methodology design rules detected. Critical violations may contribute to timing failures or cause functional issues in hardware. Run report_methodology for more information.
open_checkpoint: Time (s): cpu = 00:00:46 ; elapsed = 00:01:12 . Memory (MB): peak = 1446.715 ; gain = 1113.500
Command: write_bitstream -force FSM_Complete.bit
Attempting to get a license for feature 'Implementation' and/or device 'xc7a35t'
INFO: [Common 17-349] Got license for feature 'Implementation' and/or device 'xc7a35t'
Running DRC as a precondition to command write_bitstream
INFO: [IP_Flow 19-234] Refreshing IP repositories
INFO: [IP_Flow 19-1704] No user IP repositories specified
INFO: [IP_Flow 19-2313] Loaded Vivado IP repository 'C:/AMDDesignTools/2025.2/Vivado/data/ip'.
INFO: [DRC 23-27] Running DRC with 2 threads
INFO: [Vivado 12-3199] DRC finished with 0 Errors
INFO: [Vivado 12-3200] Please refer to the DRC report (report_drc) for more information.
Integrating Hard IP ELF/MEM with the PDI.
INFO: [Designutils 20-2272] Running write_bitstream with 2 threads.
Loading data files...
Loading site data...
Loading route data...
Processing options...
Creating bitmap...
Creating bitstream...
Writing bitstream ./FSM_Complete.bit...
INFO: [Vivado 12-1842] Bitgen Completed Successfully.
INFO: [Common 17-83] Releasing license: Implementation
22 Infos, 1 Warnings, 0 Critical Warnings and 0 Errors encountered.
write_bitstream completed successfully
write_bitstream: Time (s): cpu = 00:00:28 ; elapsed = 00:00:29 . Memory (MB): peak = 1931.922 ; gain = 485.207
INFO: [Common 17-206] Exiting Vivado at Mon Feb 16 13:39:34 2026...
